,Unnamed: 0,Unnamed: 0.1,name,date,title,review,vote,rating,logistic_sentiment
65,65,65,dhwalin,2020-11-27,🤣 I am afraid my parents might put firestick on FIRE 🤣,"From the day I got this product, my mom and dad are not sparing it for me. Sometime they listen to Saavn, sometime watch films, sometime OLD MOVIES 😨 which I never heard name before.Anyway so this is awesome product. I am really confuse what is difference with Firestick LITE and normal. But by taking risk I ordered and nothing different. I think they give just a name to 2020 version of firestick.I am running all the apps successfully. I can watch web series, internet connectivity is also good. There is nothing I can find to complain. Buy it without any doubt.",1,5,0
66,66,66,Sandesh Kotwal,2020-10-17,Good option at low price,"Today I received Amazon fire tv Stick Lite . After watching videos for 3 hours on Amazon fire tv stick Lite i am writing this review.  Packaging is very good. Installation is pretty simple.  Read the manual provided in box and anyone can install and configure the same. Noticed no lags or frame drops in YouTube and Amazon prime content  at 1080P ( I have 50 Mbps broadband internet ). This fire tv Stick remote  lack on TV remote features like sound up, down and mute. For this feature you have to depend on your TV remote.  I am totally satisfied with the performance of this Amazon fire tv stick Lite.",2,5,0
67,67,67,Rajesh S.,2020-12-20,Fire stick is not compatible with my Thomson smart TV,I am unable to connect this Fire stick with my thomson smart tv. Tried every possible move but nothing happened. Only Amazon logo is showing then screen is totally blank. Adjusted the screen resolution & reset the stick many times but no positive result shown. Anyone has any solution for this please suggest.,4,1,0
68,68,68,Amazon Customer,2020-10-31,After 1 year Firestick acts funny,This post is after I've used the Amazon Firestick for a year. Recently I've started experiencing the Firestick to pause (on any OTT) and suddenly mute. If I unpause the video starts but no audio.Unless you restart the Firestick the problem continues. So please please be careful while buying this product.I DO NOT recommend to buy this product.,3,1,0
69,69,69,Naresh Kumar,2020-10-19,Amazing Product,Really amazing product.....It was a dream for us to watch youtube and prime in our non android tv.... This device made it as dream come true....Installation also very Easy.....No no need to wait you can buy it definitely,3,5,0
70,70,70,RAMAKRISHNA MARADANA,2020-11-09,It's really a smart device,It meets all your smart requirements that you expect from your normal TV.Very compact in size and mind blowing in smart features.ProsSo many entertainment appsAlexa (I enjoy a lot with alexa)Screen mirroringSmall remoteSuperb value for money @2099/-Cons:Found nothing yetNo TV control (It's not a big deal and you can use TV remote)No dolby (but sound and picture quality is just amazing)ConclusionIf U are looking for a smart upgrade for your normal TV then go for it.Worth buying for the reason 👆👆👆,1,5,1
71,71,71,Arun Nelson Soren,2020-10-19,May not work with every HDMI supported TVs,HDMI support is not enough if your LCD or LED do not come with HDCP support. Most of TV before 2015 do not come with additional HDCP support.  So make sure your TV also have HDCP support.,3,3,0
72,72,72,kuku,2021-08-27,Good product,"If you have hd tv but it is not smart tv this is a very good product to turn it into smart tv.Voice remote works perfectly and streaming quality is stunning I mean you would be amazed that your tv can produce such clarity in pictures, of course it also depends on your net connection.All in all good product, I think it is even better to purchase simple hd tv and firestick rather than a smart tv as firestick is protable and most of smart tv in market have bad ui experience.",0,4,0
73,73,73,Ivar,2020-11-22,"Works like a charm, loving it so far, was worth the buck","Bought this as my 10 year old Samsung LCD TV isn't smart and I can't get rid of the TV as I spent over 55k for the TV. Have been using the Fire stick lite for a little over a month now and I'm thoroughly enjoying it. Setup was pretty simple and straight forward. I'm now able to watch Prime, Prime Music, Aha, MX Player etc.. The streaming is handled very well and rarely have I seen a lag, of course, due credit to my 200 Mbps broadband connection as well. I understand we could play games as well, but I haven't tried that yet...",1,4,0
74,74,74,Harsimran Singh,2020-10-20,Perfect,"Got it in Rs. 2kReceived in perfect conditionI really like the amazon fire stick liteEasy to installInterface is very easy to interactFrom youtube to netflix, amazon prime every leading media service is available",3,5,0
75,75,75,Renjith,2021-04-10,Replace your cable tv,"This is a great product and a must-buy nowadays as we all have broadband at home. We do not need cable TVs anymore. This product has limited storage so, the apps that you can install is limited(still it is enough for normal user). You need a subscription to watch Netflix/Hotstar though Zee like Apps can be used without a subscription too(paid option is also there). I would suggest going for the 'volume control' included model instead of this as there is no automatic volume control. Also, I found an issue recently that it cant connect easily to certain routers(TP-Link). It will take some time to obtain the IP address.",0,4,0
76,76,76,Shailesh,2020-12-09,Value for money,"Fire stick is excellent product. I used it with my normal LED tv and it works like smart TV. Except mobile pairing everything works nicely. I am using itvwith our mobile network without any surfing delay smoothly. Netflix, Jio cinema, Voot and Hotstar I am using. Can watch my all favourite channels live or veiw dhows in advance. Also view can watch my selected movie without be any showcase charges. I have cancelled almost all my paid  channel in my DTH tv. On the whole it is economical and convenient. You may need about 4 to 6 GB data if you use it for about 6 hours depending on your use. Those who are considering go for it",1,4,1
77,77,77,Chetan,2021-03-24,"Replaced device is faster, beware of refurbished devices in new box","12-Aug-2021------ the remote back cover started rattling/moving.3-Aug-2021----I guess on 12-march they delivered the refurbished product in a new box. ( The discription said NEW device)After 4 months prime video started hanging, device replaced as it was under warranty.The new device is faster and remote back cover isn't moving (still the irritating physical button click sounds exist).12-March-2021----Operation is slow, sometimes lags. Remote is poor quality, the buttons and back cover moves alot. Buttons make irritating click sounds.",0,4,0
78,78,78,customer,2020-10-28,stick is good but firetv os,"doesn't support airtel xstream one of the most popular one. do have the xstream app in store but without livetv support, which makes it useless.. this app is available in android tv. none of the older version apk you find mention in various youtube and other blogs will work with this 2020 model. fireos should be more compatible to android tv else it will be always better to go for later due to wider base of android and apks available.if you plan to use it with echo (even old echo dot 1/2 gen with BT) you don't need the remote and go for lite only.",1,2,0
79,79,79,Malleswara Rao,2021-01-27,Not working with VU TV,"It is not working with VU TV.Initial startup and immediately stops display. As suggested by Amazon services, updated the software by connecting it to Samsung TV (here it is working as expected). When connected back to VU Tv its not working, the same problem again. TV's HDMI port is working with setup box, so issues with TV, its problem with Fire TV Stick.Went with replacement but still same issue continue with 2nd one also.",1,2,0
80,80,80,Swaraj Banerjee,2020-12-20,Beware of Amazon's fraud: DON'T BUY,"Don't buy. I got a defective product. It also looks to be an old one. Not premium quality. I'm a regular buyer from Amazon but it's very obvious that Amazon's service is gradually deteriorating. I couldn't even give you full product review as it doesn't work. Anyways, go for other shopping sites and other streaming TV sticks.",2,1,0
81,81,81,Bijoy K B,2021-04-06,A perfect device to make your TV smart!,"I was somewhat confused between this device and the Mi TV stick. I wanted to sideload external apps which was easily possible with the Mi tv stick. After a bit of research, I found that sideloading apps was also easily possible in any fire tv stick device. You just need to download an app called Apps2Fire. With my doubt cleared, I bought this device during a flash sale for Rs 2299. I can now say that it exceeds expectations. I would recommend everyone to buy it without a second thought.",0,5,0
82,82,82,chaju💜,2021-08-29,Money saver,"This is best.. saved lot of money as i hd to recharg D2h everytym jst to watch Z marathi channel.. i can nw watch my fav channels for free + new movies, series..  HD quality .. m hvng Sony LED (2011) but did nt hd anroid features in it  and this fire stick made it all amazing.. i can e1 connect my mobile or can watch any thing i like from youtube on big screen... Loved the product .. worth buying💞❤️",0,5,1
83,83,83,sRiNs,2021-03-06,EXCELLENT.....NO VOLUME BUTTONS AND THERE ENDS THE DIFFERENCE...,Very useful for all non smart TV owners....Useful even if you have a smart TV but with an annoyingly difficult User interface.... the lite version has all major functionalities of the main version....So if the price difference matters....go for this....One star less as the absence of volume and mute buttons can be a tad annoying at times....But really ..if one is OK with that as I was...This is as good as the original fire stick.....the extra 1500 is only for a measly volume button.....,0,4,0
84,84,84,Yashwanth,2021-01-21,Ok product. Bought for 2300 rs.,"Excellent. Got today , and got an software update, done that and used for 3 hours. Good connection everything working fine except screen mirroring there is some lag during screencast. Thought buying mi stick but they don't provide batteries and HDMI extender as I need extender and fire is is better than Android 9 os on mi tv stick. Guys buy fire TV stick only . If u want volume controls spend 500 rs more and buy 3rd gen stick. Lite is also good. Super fast connectivity. It made my 6 old 19 inch Panasonic tv to smart TV. Thinking to return it and buy MI stick don't know anything about mi stick thinking to give it a try .",0,3,0
85,85,85,Anfin Ahammed,2021-01-17,Worth Buying,"Remarkable product. What an amazing product. Nice design and very easy to use. Alexa voice recognition is very helpful. You can use the FireTV application as a remote. And use the keyboard in that app. It's very helpful. All the way I love this product. Thank you, Amazon for another incredible product.",1,5,1
86,86,86,Tanveer K,2021-03-15,Go lite and save money. Complete value for money device.,"This is my second Fire stick. My original fire stick is now running on my parent's tv. I did not wanted to spend that much this time so I went for fire stick lite. And guess what, it's totally worth it! I had few apprehensions whether the lack of volume and power button will be inconvenient, but so far I haven't felt a need for them. FS lite is much faster then my original Fire stick and the new user interface is also great. The new fire stick is more intelligent and only shows content from the apps I've subscribed to. The live tv button is also a nice addition and you can access TV channels from all the paid apps you've subscribed.All in all, FS lite is a complete value for money device and in my opinion it's not worth to spend more just got volume and power button. If you don't want access to 4K content this is the fire stick you should buy.",0,5,0
87,87,87,Bharti Patidar,2021-09-04,EXPERIENCE 4K IN HDR,"Best streaming quality ,you can feel your tv like 4k in HDR tv also ,it runs great on mobile hotspot also ,but only problem in it is ,it's build Amazon prime whose Audio is very low ,not able to listen clear talking in filming ,which forces us to increase tv sound ,which at the time of action in movie creates noise pollution in room ,.it's humble request to a amazon to fix this issue in Amazon prime video as other OTT APP'S SOUND IS GREAT",1,5,0
88,88,88,suman d.,2020-10-20,Superb product,"After two days of uses I must say that....A superb product from Amazon. Somebody says its data hungry. As I have unlimited plan, so I dont bother with it. And about no audio controll... as my led tv(I think many others) has very low quality of inbuilt speakers, I am using separate speakers for the tv and thats why 'no volume control' cant effect. Only I would say about its downside that though the sideloader apps installed easily, but proper icon of those apps not showing properly . I dont know if there is trick to do so.  I think in next update Amazon will fix this issue.",1,4,0
89,89,89,Mitra Subhrojyoti,2020-11-16,Value for money... Bye bye DTH,Must have hardware in your living room if you've got broadband. Install jiotv and aptoide tv to acess most live channels over ip. Voice recognition is fast and works like a charm. Highly recommend.,2,4,1
90,90,90,Ravendra Patel,2021-01-29,Product is good but think many time before purchased,"Fire TV is good if you subscription of many thing, you can;t install genuine software as play store(don;t expect), Alexa search is worst  specially if you have practice google search.In summary Alexa search like as Yahoo search Not Google search.Device with voice control will better otherwise you need to take 2 remote one for voice one for operate other things.Sometime you can manage software from the TV remote as well, but your TV voice will be in issue and may be you need to restart TV(in my case).",1,3,0
91,91,91,Abhijit,2020-10-29,Go for it if are least concerned about Atmos & 4K.,The overall product is good & took 10 mins. to setup. If you don't want dolby atmos & 4K feature than go for it because even if you don't have atmos still you get dolby digital & digital plus audio options which is enough to experience good quality audio with awesome hd picture quality.,1,4,0
92,92,92,RAMU G,2021-04-04,Problem with Sound,"When watching movies in prime or hotstar , sound is very low for dialogues and very high at action scenes. Dont know app issues or fire stick issues. There should sync between dialogues sound level action scenes background sound level. Issue not observed in YouTube or aha app.",2,2,0
93,93,93,ankit,2021-02-08,Buggy and poor support,Hotstar as promised does not function.Also the customer support is very poor. They keep you hanging. I probably had 6 hours of call with them in total and everytime yhey woukd lie. They made me switch to Google Chromecast because of the poor support and buggy device.,1,1,0
94,94,94,Alok Pandey,2021-03-22,Stream infotainment content flawlessly and hasslefree,"The connection with my Micromax LED TV is smooth and without any lag. I am.able to stream.content on JIO mobile WiFi. You can install apps from outside of any of the store and integration is smooth. Since Oreo isko more available hence go for Thop. It functions perfectly. There are international channels which requires more faster and stable internet connectivity hence those I am.unable to stream at times. Rest all the other channels , movies, shows stream.without any issue in JIO mobile WiFi. On moderate usages at 360P 1.5 GB of JIO data is.more than sufficient. You can stream content on mobile without any extra plugin or app. Video call can be streamed on TV but for audio you will have to use bluetooth speaker or your mobile speaker. Remote is good and sturdy. Voice.recognition is flawless. Good thing is that you get an HDMI extender with it which is very useful. In my case the HDMI input is behind the TV panne hence I would require to connect it anyways. So do check your HDMI port location before buying any casting device. An HDMI extender comes very useful. With Fire tv stick it is included soniya good. And the quality of battery provided is also good.",0,5,1
95,95,95,Rishu,2020-10-17,Best Streaming stick in the market,"This is the best streaming stick in the market. With 1.7GHZ processor, its very fast and with voice search, time spent in searching and launching content is reduced. Streaming is smooth and buffer free and the interface is a delight. At 1999, this is a steal. On top of that, the discounts on apps like Zee, Sony and Voot are just too good.",1,5,1
96,96,96,Aayush Sharma,2021-06-25,Worth it....,"It is good.....The ui is also improved and good as the 2nd gen fire tv....I've used both....It's actually faster than the previous gen fire tv....Overall good....I like it....go for it.....And do not be a fool to buy mi stick or other streaming devices like Motorola or Nokia..... ull have to regret if you do so....I tried those too....But it's not good at all....U can either prefer the mi box 4k either if u want the better ui (not as good as the fire os) and a fast experience (than the other streaming devices, fire stick excluded)....But if you want the best one....undoubtedly go for fire stick....It's really good....",1,5,1
97,97,97,Nikhil Pradhan,2020-10-21,Cannot get better than this for 2k,I own a Marq Chromecast tv device (with remote)  and a google Chromecast 3rd gen already and this is the new addition for my monitor and projector screen (you dont need volume controls for this) . This is the best of all three hands down in terms of responsiveness and also how well the remote works. For example you cannot open any series on Hotstar directly using Google assistant (from you home mini or remote google assistant) but from Fire Stick remote you can control these apps as well.,1,5,0
98,98,98,renjith,2021-09-05,Will stand upto regular firestick,"If you can live with lack of volume and app buttons, you are not losing anything by opting for lite version. But, I am unable to make it work with external speakers. It connects fine,but no audio (stereo option was selected under audio). I got a replacement,but it also behaves the same. It looks like purposeful to make it a lite version.",0,4,0
99,99,99,sammed jain,2021-09-08,UI isn't user friendly !,"I know amazon fire stick is the best in the TV stick market. But after using this for a month , i think it's UI isn't that user friendly. My uncle found it somewhat difficult to opearte this , where as he was all ok with android tv interface which you get in some other TV sticks .Casting is another issue in these TV sticks.You cannot instantly cast your content just like android Tv ( which comes with built in Chrome cast )...These were some problems with this fire stick...To be more precise let me say , these were some differences which I noticed between Android TV and fire TV.",0,4,0
100,100,100,Savio R.,2021-06-26,Good investment.,"If you're choosing between a smart TV and the firestick I'd suggest go for the firestick. Reasons as below:- Smarttv internal memory is 4 gb and firestick internal memory is 8 gb. Useful for installing apps and cache memory.- Cheaper than smart TV in terms of new TV and repair cost.- Options to choose between top end and low end firestick.- No need to have prime to use the firestick- Easy to plug and play plus stream music, play games and live TV.If you're still deciding, invest in a larger screen TV and go for a firestick instead of a smaller smart TV. You won't regret the decision.",0,5,1
101,101,101,Amazon Customer,2021-03-31,Batteries provided in the box are old,"Everything is perfect with the Fire Stick, however the battery provided with the pack is too old and out of charge because of which the fire stick was not able to recognize the remote which I spent most of my time to identify the reason behind why the remote is not recognizable because I thought the amazon provided could not be old and I thought of returning the Fire stick by stating remote is not working as a last try I tried with different batteries then immediately the remote is working. So amazon please provide the new batteries",0,4,0
102,102,102,Ankit Jaiswal,2021-09-09,Clearly it's the best one,"If amazon did anything awesome was to launch the lite version for fire stick...I have a normal samsung tv and I don't want to change it till I am shifting to new house. And I needed a good replacement for an Android tv ... also I didn't wanted to spend 5k for that... But then I saw this fire stick lite at just 2k... This is the best thing.. I have nearly everything what a normal user can get through fire stick.. I can view all content on HD, I can connect it through bluetooth devices, can use it as mirror cast.. can install whatever app I want, Can play games... And first and most I had to replace cable connection with online tv... Those cable connections are lost every now or then also DTH is sometimes lagging during thunderstorm or rain... To this has proven to be the best replacement for all my need that too within my budget...",0,5,0
103,103,103,Bhaskar Modh,2020-11-25,Same as old Firetvstick in lesser price.,"Picture quality, performance, quality everything are superb.Apps : Netflix, Prime Video, Hotstar, Zee5, Voot, Sony liv, Discovery, Mx Player, Jio Cinema, Apple TV and many more.",2,4,0
104,104,104,SREEJITH PT,2021-03-12,Amazon prime video not working!,Everything is ok except amazon prime.. Trailer is working.. Not movie playback.. Youtube is super smooth.. Customer care also useless with dumb questions and they are clueless.. No return window also as i recently only tried amazon prime video..,2,1,0
105,105,105,Lokesh Katyal,2020-11-08,Oppo phone delivered instead of firestick,You have delivered an oppo phone instead of firestick. Deplorable delivery management.,4,1,0
106,106,106,prem sagar,2021-02-13,Good as expected,"Giving a 5 star as it serves the purpose.. but yes the normal or usual version which is Rs 1000 costlier is more comfortable as it has the power and volume operations. But then if you don’t wanna spend the extra 1000 bucks, go for it. Also need not mention, but the quality of remote is also good as expected.",1,5,0
107,107,107,Koustubh,2021-06-02,Go for it!!!,Go for it blindly... It's awesome I'm extremely satisfied. I'm using with Video on led tv which is 2015 model. You need hdmi port and a charging socket near to TV.Only two cons: no volume button and no power off...,1,5,0
108,108,108,Teshender,2021-07-06,Clever fire stick. Read this carefully...👇!!,"Before installing. Take this steps strictly otherwise you are always be in problem. Fire stick send a error messages again & again you can't handle. You are blasted With the error messages.  Follow this steps strictly1. Get off your TV from the wall.2. Free your TV from all the wires.3. Push the on/off button continuously of your TV atleast 10 minutes without any wire.4. After 10 minutes. Install the fire stick in your last running HDMI port.5. (Important) Don't install the fire stick in your non running HDMI because it's not working & you are fed up with the error messages again & again.6. After installing the fire stick. Reinstall all the wires, HDMI & USB. What ever you want on your TV.7. After these 👆 steps. Install your TV in your wall.8. Before starts the TV. Turn on the Wi-Fi of your phone or internet connection. What ever you want.9. Turn on the TV.10. If TV is on. Go immediately to the fire stick HDMI. Fire stick takes 15 minutes for updating with your amazon account.11. Be patience for 15 minutes.12. After that your fire stick running smoothly without any error & collaborate with your TV HDMI & motherboard very well.If you are not following these 👆 steps before installing fire stick. You can't handle the situation & definitely you are return the fire stick. Fire sticks knows very well how you are operate the fire stick.",0,4,0
109,109,109,padhu_lp,2021-03-25,Laptop mirroring doesn't work,"I bought this mainly for mirroring my laptop screen on a TV. Though there are claims of screen mirroring, my laptop doesn't connect as a wireless display. On further checking, I find Amazon never explicitly say anywhere that windows 10 Laptop screen can be mirrored. It only says mirroring can be done from Android devices and tabs. It works from my mobile phone though. A big disappointment for me.",0,2,0
110,110,110,Asma shaikh,2021-02-21,Great streaming device.,"This is just awesome, super adorable at this price you'll get many outdated streaming devices like mxq pro which doesn't even have blutooth in it but Amazon fire stick is totally different it has all the necessary features including blutooth 😍.I only found 2 cons1ST: There is no option to close blutooth. The blutooth will be turned on all the time even if it's not in use, these is totally waste of fire stick energy ( it will also effect on its life span too ).2ND: The Alex voice search doesn't work over 90% of the time which kinda makes it useless feature. ( I personally don't use voice search so I'm ok with it )But rest of the things works like charm so if you are ok with this 2 cons then the fire stick is for you.",0,5,0
111,111,111,rakesh,2020-10-17,It's fire literally fire tv stick lite,"Your browser does not support HTML5 video.
  Packaging was environment friendly ,started with few updates for my old tv Samsung with no smart options ,small device with powerful options recommend for tv without any options",2,5,0
112,112,112,Dr Daya,2021-02-18,Simply awesome,"Excellent voice recognition & Alexa integration. As mentioned, volume control not available. Streaming quality is great. Wide range of apps available over App Store. Small & light weight remote with simplified button. However, remote doesn’t have dedicated buttons for special apps like YouTube. Overall, go for it.",0,5,1
