,Unnamed: 0,Unnamed: 0.1,name,date,title,review,vote,rating,logistic_sentiment
237,237,237,Mounika,2021-01-01,Good with minor issues,"Sometimes when we search with voice commands, we don't get response in voice. Also for few apps we need to set content language every single time. Rest is good. There is no volume control for variant we took",0,3,0
238,238,238,Narsaiah Pantham,2020-11-30,Not responding and not working since two days.,"Since day one volume is not control not working, stop control not working and finally since last two not working totally. It is not responding to remote even after all alternatives tried including changing with new batteries. I have feeling that the Amazon supplied with defective one. I lost the amount within a short time so is my happiness of watching movies. Now I am lost as what to do with it.",0,1,0
239,239,239,Aena,2021-09-27,One of the best experience 😍 A must buy🌸,"Your browser does not support HTML5 video.
  Ordered for my ego tv. I was little confused to buy or not as i was not sure it will work on my ego tv when i saw i review on amazon a man saying it is not working on lg was confused to buy or not just took a risk and happy with the firestick a must buy for all the big screen lovers out there❤️😍😍",0,5,0
240,240,240,Kamal,2021-02-07,Very good product sir ji,Very good product i am buy 3 time your fire stick such amazing product sir 😘😘😘😘,1,5,0
241,241,241,Sheetal,2021-04-28,Not worth it..,The product is good only if it’s working but sometimes it’s keeps on restarting and won’t work. Have tried to find a solution on google but no use. Don’t waste 2k rather buy a new smart TV.,0,1,0
242,242,242,ANAND VIJAY,2021-10-04,Loved it,"Bought this for my brother. Now his tv is like any other smart tv. In fact now I think it is Better to buy a normal tv of high quality and connect fire stik to make it smart rather than buying a smart tv at a very high prize. Overall nice remote, easy to connect. We don't use alexa and all so don't know about it.  Totally satisfied with the product.",0,5,1
243,243,243,Kuldeep,2021-08-30,Smart tv experience,Firestick is convert my regular LG 24 inch hd tv into android like present smart tv. But consume more data in amazon prime if there is option for quality adjustment then it better.,0,5,0
244,244,244,Yashdeep Chauhan,2021-02-04,Great and easy to use device but needs a bit of update.,"Its a very good device and easy to use. Have been using it for over a month now.Only one problem i encountered with this is while using few apps, it will not play the content. Have to restart the fire stick and then it works fine.",1,4,0
245,245,245,ranjini,2021-04-25,Worth buying,This has got to be one of the best tv streaming service worth the money and does not have an loading error like the Google chrome cast I would recommend this over chrome cast if you're looking for a streaming device that is cheap but has a good quality and easy to handle this product is for you! I would recommend this over the google chrome cast because the chrome cast was faulty after 2 days,0,5,0
246,246,246,Ayush Sharma,2020-12-06,Fully Satisfied / Best in segment..,"I just fall in love with this..This is much better than my expectations, best fire stick in segment. Plastic quality of remote is best in class( premium) i buyed fire stick lite..This is very quick in response and doesn't show any lags. I write this review after 1 month of use.. Fire OS is more faster and quick in response than android OS.. This is much better than MI TV stick..",0,5,0
247,247,247,Avinash Kelkar,2021-03-23,nice,"working very nice. if you face problems getting ott apps like zee5, sonyliv etc. you will have to change country to india in Amazon registration. site is www.amazon.in/changecountry",0,5,0
248,248,248,Bhooshan,2020-10-24,Good quality interactive response but limited access features,Good picture quality & interactive voice response. Remote size too small to handle as no rubber grip case provided. More distance operative range. Returned due to limited access & seeking subscription for several apps & not Android based operating systems. Not even bluetooth connection features along with wife. Mirroring is also not convenient & ease of connectivity.,0,4,0
249,249,249,mani kumar,2021-07-15,It's wonder of amazon to make normal TV to smart tv,"Your browser does not support HTML5 video.
  Is streaming quality is great.  With fire stick your normal TV becomes perfect smart TV. And also voice recognition  and alexa integration is awesome",0,5,1
250,250,250,Aditya skaria Gamuz,2021-08-23,Excellent except they are charging 800 rs more for firestick with volume control!,"Returned this simple because I couldn't control volume, paid 800 rs more for 3rd gen versión which has one main difference it can control volume. Really stupid but this is the truth",0,3,0
251,251,251,A. Patel,2021-04-10,Excellent product,Very nice product compatible with most of the tv. Overall performance is good. Only thing I did not is MADE IN CHINA.... Looking fwd to MADE IN INDIA device soon.,0,4,1
252,252,252,MirAli,2021-03-24,Product details,I like the voice feature. I use with with my sony smart tv. I like the product but if we can get volume come control in the same price it would be more useful and helpful to customers.,1,5,0
253,253,253,Mangesh Mane,2021-03-13,Very Good I am loving it.,Good Product.. My normal Led tv become smart Android Tv. I have disconnected my D2H after purchasing. Don't waste your money in D2H and Cable etc. Buy fire stick and save your hard earn Money. Only issue with Internal storage it should be minimum 16 Gb..,0,5,0
254,254,254,Sanjit kumar pandey,2020-10-22,Loved It.,Just a small review below.•Ordered on 18 and Received on 21 of October.•Unboxed and First impression was like wow.•Very Easy To Install.•Recieved 2 Updates and after logging in with Amazon Account you are all set to rock!•Alexa Voice Control was like a Cherry on top (Loved it).Yeah! Just Go For It.,0,5,1
255,255,255,Altamash,2021-02-20,Useless because of no volume control,"Pathetic design, I don't believe you can think that silly..Believe me no volume control makes it useless..",1,1,0
256,256,256,Rajesh,2021-01-20,Buy a simple tv and buy fire stick android TVs are very slow,Android TVs are slow firestick is very fast n responsive the remote is very cute and sturdy has all channels and very good for the price thanks Amazon,0,5,0
257,257,257,Priyanka06,2021-09-26,Remote not working properly.,"I had raised a complaint earlier too that the remote is not working properly. It stops working on its own and everytime the battery needs to be taken out , not just this the buttons don't work , skips to the home page if I press  back button.",1,1,0
258,258,258,Hanish Choudhary,2020-11-12,Excellent product,Excellent product my normal led tv turns into smart tv with interesting features. highly recommended. Must buy,1,5,1
259,259,259,Nandana Bhattacharya,2021-07-29,Lockdown Enjoyment item,Very useful for ppl who can't afford cable connection or who don't want tv cable problems. In this lockdown it was very great to have bought this item.,0,5,1
260,260,260,Saju F.,2021-09-20,Good one Affordable when it comes at the fair price,No wonder after the long wait finally I brought the fire stick. The festival offers paved the way to buy. Don't go for the higher price if you are planning for your tv upgrade.  2099 is a fair price.,1,4,1
261,261,261,Ram,2021-06-19,Value for money,"After taking broad band with unlimited internet, the need for entertainment rose and I have seen fire tv in my bro place so decided to go for it.This is 1.5k priced less but still serves the purpose. Enjoying ever minute of smart TV in my plasma tvAlexa is smart and good time pass to ask questionsGo for it.",0,4,1
262,262,262,Sanju,2021-03-15,It gives an amazing experience,A normal TV has become a great smart TV. Quality of entertainment has improved drastically. Must buy. We don't use a cable anyone. YouTube has a mine of entertainment videos. Recommended buying.,0,5,1
263,263,263,Abhishay Srivastav,2020-12-09,Does what it says but should have had volume control,"The lite version doesn't have volume control but would have been very nice to have. Once you switch your tv on, the user shouldn't need to use the tv remote for any other control.",0,3,0
264,264,264,Sagar Gaidhani,2021-07-23,Best streaming device,"It is similar to plug and play, smooth HD streaming even on nominal internet speed, high speed internet not required.",1,5,1
265,265,265,Vikas Thakur,2020-12-27,Firestick lite is best for watching online content on HDMI - TV and Monitor,"Good one to purchase, all the latest apps available. Alexa voice working on firestick software, prime app and YouTube. It can be connected with Bluetooth speaker. Alexa Remote included and Android app also available for firestick. Volume button not available in lite firestick, but you can control volume directly on speaker.",0,5,0
266,266,266,Pravin,2020-10-25,dont go for lite,dont go for lite having tv and volume ctrl is worth the extra bucks. Non lite version was unavailable when I bought and had to go fir this 🙄,1,3,0
267,267,267,Dileep,2020-10-26,I am shocked to note there is no Volume Control on the Remote,"A month ago, i bought another Amazon Fire Stick - which has volume control on the remote. I am totally shocked to see that there is no volume control on the Remote received with this order. I would request you to send me the remote with volume control",1,3,0
268,268,268,Debarghya Mitra,2020-11-01,Great streaming stick for non smart tvs,Nice product according to the price of 2k..Better and faster processor than fire stick 2019..Very smooth and no lags..Only drawback no volume options in remote and no 4k...Otherwise great,0,5,1
269,269,269,Prakash Deshpande,2020-10-31,Good Entertainment,"The Fire TV Stick Lite with Alexa Voice Remote Lite is extremely nice device which made my TV a smart TV. It is a full of educating, informative & entertainment device.  Delivery of the product is early & in good packing condtion with all specified accessories. Thanks Amezon for such nice useful device.",0,5,1
270,270,270,Vi,2020-10-18,Unable to connect HDMI Port to TV,"My TV does not support HDMI port unable to connect, what to do please help",3,2,0
271,271,271,Bilal A Wani,2020-11-15,"Amazing product, just loved this","This is amazing product, it exceeds your expectation. The way the product is packed tells lot about the quality of this product. Works effortlessly and surprises the buyer.",1,5,0
272,272,272,Virbala Shah,2020-12-22,Not recommended,Alot of improvements needed.. Alot of issues present now,2,1,0
273,273,273,Jayesh p.,2021-06-02,This fire stick transform my Normal LED tv Smart tv.,Product is very good. Worth of every money. I purchased this on proce of Rs.2300. This fire stick transform my Normal LED tv Smart tv. Video & Audio quality is superb. Go for it!!!!!10/10 Rating.(Note- if you want volume keys + power on/off dedicated buttons then don't go for lite version of fire stick),0,5,0
274,274,274,Souvik Naskar ,2020-10-25,"Without 5ghz wifi, Bluetooth devices can not be paired with the device.","Device is good. But Bluetooth is not working.Without 5ghz Bluetooth device can not be paired with the device. Normal 2.5ghz is not suitable, very disappointing. Need to improve.",0,2,0
275,275,275,Jatin,2020-11-27,very pathetic quality,didnt expect this from amazon its hardly been 20 days and the product is not working ... it starts but hangs... advisable to not got for Fire Stick LiteNot working at all...,1,1,0
276,276,276,Ravindra,2021-01-31,Worth it make ur non smart tv into smart tv,"Update- Streaming Is Real Op.Voice recognition is also nice, it recognises everything I speak.Overall it's OP if u have a non-smart tv.Really nice fire TV stick. Really love it. Gonna use it more and then update the review if any problems occur but for now thank u Amazon for clean nice packaging and nice product love it.",0,5,1
277,277,277,Sathya_TN,2021-06-19,Excellent streaming quality,Streaming quality is excellent and I have a good wi-fi strength. If you don't have a smart tv and have good wi-fi time to convert it to smart tv using firestick!,0,5,0
278,278,278,a m n,2020-12-05,Great product except it's missing tv on/off and volume controls,"Latest 2020 version, interface is smooth, very less to no lag, Amazon integration is great.However I would recommend to go for the one with tv control options as it more practical than this lite version albeit a bit more expensive.",0,5,0
279,279,279,Suvadeep Ghosh HD,2020-12-30,Easy method to make your normal TV to Smart TV,"This is the most easiest method to make any TV to Smart TV. You can use your mobile as a remote. Cast your PC, Laptop, Mobile screen easily.But there is no volume button and power off button. You can use your voice to ""turn off TV""",0,5,0
280,280,280,Amazon Customer,2021-08-28,Great product to make your TV smart,Good product easy to install but takes time to setup the first time. Works like a breeze. Very happy I purchased it for my old Samsung TV.,0,4,1
281,281,281,Ramandeep Singh,2020-12-27,"Super smooth and easy to access every app,screen mirroring etc.","After 1 day of usage, I feel like the product is working really good, My network bandwidth is 5ghz and its working super smooth. Alexa integration and detection is really accurate. I inserted the stick in Lloyd Tv and its working really good.Totally worth it.Volume control is missing in lite, Its ok we can use the normal tv remote to change volume.",0,5,0
282,282,282,manu saini,2020-10-22,Screen mirroring not working,It is not working in screen mirroring with oppo f17 pro,3,1,0
283,283,283,vivek,2021-07-19,Worst every penny,"I BOUGHT THIS FROM A NEARBY STORE AND IT HAS TRANSFORMED MY ORDINARY  TV INTO A SMART TV.AT Just 2999 it is very cheap and awesome.I am able to watch all latest movies,access the internet and do a lot of stuff .Thank you Amazon for making this marvellous gadget",0,5,1
284,284,284,G.Muraleedharan,2020-11-23,Cheapest Firestick .,"Nothing wrong or less attractive about Firestick lite,except that it lacks volume control.I don't use voice or Alexa,and it does not matter to me.",0,4,0
285,285,285,JK93,2021-04-05,Superb product. Go for it,Everything is perfect.But I noticed loss audio and after restarting it works fine.And sometime I face difficulty to connect to wifi.And Alexa confuses with my voice..😂😂,0,5,0
286,286,286,Nupur,2020-11-20,Awesome product by Amazon,"I was skeptical about purchasing this product but decided to give it a shot.It feels great that it makes your non-smart TV, a smart one. I am planning not to recharge my DTH coz I wouldn't need it.Great product, superb picture and sound quality.Thanks Team Amazon! 😊 You never fail to make us happy.",0,5,0
287,287,287,Rajesh Kumar,2021-01-26,Poor Quality product spoiled within 3 months.,Low quality product. Sound stops on its own during watching TV. Need to restart TV again to get the sound back again.Tried many times without firestick and there is no issue but with firestick issue is coming every day.0 ratings for this product.,0,1,0
288,288,288,Amazon Customer,2020-12-12,Interaction,"Bought it for Rs. 2099/. Pocket friendly product with all features except volume control. Connecting wire is thin, may cut loose if not handled carefully.  If you are OK to have two remotes, then go for this product. I am using another remote for volume and power, did not find it difficult.",0,4,0
289,289,289,Sanjay K.,2021-01-14,Number 1,Tv dekhne ka experience ekdam badal diya hai alexa ne. Ghar me sab se jyada fayda chhote bachho aur dadaji ko hua hai. Search processing bahut fast hai. Android ka baap hai ye,0,5,0
290,290,290,Ve7178,2020-10-17,Nice 😊,Lite version is superb. Quality of product is good. It's fast and easy to use. Takes just 10 minutes to install and update the software. Quality of plastic is good. Just go for it.,0,5,1
291,291,291,Mohan R,2021-02-28,Wonderful product,"Nice product ., My long term dream to watch you tube on my LED tv came true today. However, we need to have high speed internet for high quality streaming videos. Its really worth product",0,5,1
292,292,292,Sanket,2021-03-10,Dont buy unless you want to waste your money and then regret latter,Honestly dont buy it go fro smart tv instead because it lags and have so much of connectivity issues even though my witi and internet connection is stable and fast it has connectivity issue and i need to restart it every time! It’s irritating to restart the fire stick 10 times a day! Waste of money!,0,1,0
293,293,293,Munir Surve,2021-03-22,Fire stick not working after 2&1/2 months.,2.5 months and it stopped working.device is connecting to wifi but can't connect to internet. While other devices like mobile phones etc.are connecting fire stick is not getting internet .Where to get help.,0,3,0
294,294,294,Reetu,2021-01-21,Awesome,I just love it. It's awesome product. Just go for it without taking a single minute. Now I can watch my favourite series & movies so easily. there is no volume control button. Only one drawback that You have to use your regular remote to control the volume.,0,5,0
295,295,295,Mariam,2021-06-26,A bliss for all HD TV to watch your content,This version was great for people who just have HD and not Dolby sound or 4K. Anyone who has a HD TV this version is the best and useful to enjoy all the content u want to watch. No need to buy higher version if you don’t have a new updated TV.,0,5,1
296,296,296,Amazon Customer,2021-01-22,"Nice product , need better remote","The tv stick works as expected,.  needs a restart once a week or so.the remote is a bit disappointment, the back cover is too weak to stick to remote.. keeps sliding off too easily.",0,4,0
297,297,297,TAPABRATA SAMANTA,2021-09-11,This lite stick is really awesome 👍,"My old lite stick was running well. But suddenly it stops working after about 11 months from the date of purchase, after a sudden lightening. I approached to the customer care team for a replacement and they replaced it. I am so..o..o happy. Thank you Customer Care Service!",0,5,0
298,298,298,Prasad Koduri,2020-12-26,review for the firestick in general,"My older firestick went bad after 2 years, no signal. I had to buy this new one again. Not sure how many years it will last. No other good options to watch online content, had to settle for this.",0,3,0
299,299,299,Priyank,2020-11-25,Screen Mirroring works super smooth,Wonderful Purchase during Big Billion Sale 2020. Got it for only 1850 after discount. Now my old LCD is working better then most of Smart TVs.PS- Amazon need to include JioTV in the Store otherwise watching Live TV can be tricky as you need to install multiple Apps for various Channels,0,5,1
300,300,300,Babani,2021-03-18,Super smooth,"This product is so awesome. Connects to wifi, Bluetooth headphones, smartphone. I even control YouTube on Tv using my smartwatch via smartphone YouTube vast",0,5,0
301,301,301,Prakhar,2021-08-22,Go for it,Its easy to use and can replace your tv cable,1,5,1
302,302,302,Amit gupta,2020-10-26,Very bad priduct,Very bda product for purchase . No tv can be shown on any app without subscriptionIf any person take subscription for all channels then it will be very costly then purchasing of monthly plan on your dth,1,1,0
303,303,303,ak mehra,2021-01-03,Cell was not worked. Old stuff,Cell was not working being old one. It is totally not good enough on your part and cell was loose. it is duty of seller to supply good part. Seller send new cell immediately,0,4,0
304,304,304,Pamela ,2021-09-21,Fire stick stops working,Unfortunately this fire stick stops working since yesterday only working for 10 months.It was never expected for such short working life.Any possibility to repair???,1,1,0
305,305,305,sourabh,2020-11-24,Good alternative for cable tv,"It's a very Good alternative for cable tv. With 3rd party apps like Thop TV and Oreo tv, all TV channels works in it smoothly. Just 1 negative point is it not having a USB port for connecting external devices like Pendrive.Otherwise, completely satisfied with the product.",0,5,1
306,306,306,Kripan,2021-09-30,Fantastic product my family liked it.,"Easy to use and operate, cant complain about the missing volume controls as it is already mentioned in the product details.",0,5,0
307,307,307,Amaze customer,2020-10-19,Excellent product of Amazon,Installation was quite simple. Steaming is very fast. No lag. Also Remote is very handy. Superb quality product from Amazon.Thanks Amazon for Such a good product and delivery speed.,0,5,1
308,308,308,Sachin G,2021-09-18,Awesome product for entertainment,Can be able to brouse on all OTT and have good entertaining time.Response time is good only battery consumption is more need frequent battery change.,0,4,1
309,309,309,DPK79,2021-02-23,Good purchase,"Great purchase to convert my fhd tv to smart tv. But guys you should update the streaming quality in settings as per 360,1080etc.",0,5,1
310,310,310,Nilanjana,2021-01-03,Fantastic,Absolutely best product. Fire stick LITE is great. The volume and power can be conroed using TV remote. The Alexa voice control is great. Love it,0,5,1
311,311,311,SHUBHAM_P,2021-02-02,Awesome product,"Gr8 product to convert your led tv into smart tv. Had some issues with resolution as hdmi  port 1 of tv didn't support 1080p but after shifting the fire stick to hdmi port 2..it worked flawlessly. Incredible product, gr8 build quality and a really smooth os and interface.",0,5,1
312,312,312,Ratan r.,2021-03-29,One of the best in the market,Writing review after 15 daysSo far so good no problems at allWorking super smooth no lag in interfaceAlexa voice recognition is on point noWiFi connectivity is also good if you have 5-10mbps internet your good to goJust buy without any second thoughtsThis thing not gonna disappoint you.,0,5,1
313,313,313,raj,2021-04-04,Best for bedroom TVs,"Your browser does not support HTML5 video.
  Bestto use for bedroom TVs, your old tv  should be a smart tv ...very important",0,5,1
314,314,314,Vibhor ,2020-10-25,Buy it,"I love this. Was planning to buy a mi 4k box, but since my tv is not 4k,it would have been overkill. Happy to buy and use it. Good buy.",0,5,0
315,315,315,Tambi,2021-07-16,Worth to buy it. Saved 40k of my money,"I coud convert my 42"" LG (42LB550A) full HD TV to smart by FIRESTICK. I Thought of purchase a New smart TV. Fire stick solved the purpose. And I have saved 40k of my money ah ha...",0,4,1
316,316,316,Nig10,2020-11-03,"Easy and fast to use, but Chinese product",Working good though it is Chinese. Not sure how long it will last but.But quality is fine and operations are also fine.Cost is a little upside.Configuration is easy and fast.,0,4,0
317,317,317,Abhishek Bothra,2021-03-14,SonyLiv and Zee5 cannot be installed,"Hi - Even though the UI and streaming quality is good, SonyLIV and Zee5 apps cannot be installed. It says it is not available in the cart. I will try for one more day, otherwise I will return this product.Overall disappointed with the product not meeting what it is claiming.regards, Abhishek",0,2,0
318,318,318,Customer,2021-08-10,Nice,"Good quality, Alexa working well, only problem is that you need extra remote to control sound and other tv features",0,5,1
319,319,319,Rinzing Gyamtso ,2021-01-24,Great !!,Haven't use Alexa but it was easy to install and use on my projector...watched first movie on prime and so far it's great!! Will try voice control and other apps later on,0,4,0
320,320,320,Parvathi,2020-11-27,"Very good buy , good performance",This was  my first fire stick. Works very well with my TV and voice commands also get recognised easily. It has made my tv smart and we al ernjoy watching it now.Seamless product. No hassles very good voice detection.Nice build too.A great deal for the price offered.,0,5,1
321,321,321,Bhushan Borse,2021-07-21,It turned TV into Smart TV,This is Amazon's best product. Fire TV Stick provide all options that should be have in smart TV. It turned my Simple HD TV into Smart TV. I can browse all featured apps and internet content on TV. Remote with Alexa is also very good feature.,0,5,1
322,322,322,Siddhant Basu,2021-03-23,Firestick not working,My alexa firestick is not working...its not even two weeks we purchased it. Need technical support to either fix it or get its replacement.,1,1,0
323,323,323,Amazon Customer,2021-04-17,Remote is Not Performing,Remote performance is too bad. It doesn't connect properly. Neither battery last much. Remote is not performing even using Amazon Batteries,0,2,0
324,324,324,ZeroCool,2021-01-03,"Good product, read my complete review","Excellent product, I use it on my android tv and I have stopped using the inbuilt functions of android tv. I don't see a volume control in this which was annoying.",0,5,0
325,325,325,Amazon Customer,2020-10-31,Good product,"Good and nice. Perfect price. Just you need to swap between two remotes at the time of viewing. But if that's not a problem, just go for it.",0,4,1
326,326,326,Rajdip,2021-09-13,It is not working after a month,It is not working after a month,1,1,0
327,327,327,Eric D'Costa,2020-11-11,Suits my needs perfectly,"Connected it to my NIKAI 55-inch UHD which would not support NETFLIX & AMAZON PRIME. But with the FireStick, I am able to watch using these apps. The picture quality is excellent and so is the response time of the Fire Stick.",0,5,0
328,328,328,Dr. A. Sandana Karuppan,2020-10-31,Over all picture quality,Very nice product for my Onida full had 24-inch tv. It is working well and streaming well. I recommend buying and convert your normal tv into a smart one.,0,5,1
