,Unnamed: 0,Unnamed: 0.1,name,date,title,review,vote,rating,logistic_sentiment
0,0,0,Mohammed,2020-10-17,Fire Stick 2020 Lite doesn't works on all TV. I have never expected from Amazon.,"The Fire Stick 2020 Lite didn't worked on LG 32LH56a LED TV 2016 Model. But worked on MI 4c pro Smart TV. The Amazon Customer Support mentioned that TV's from 2014-2015 supports Fire Stick but mine was 2016 Model. Before Purchasing, please see whether your LED TV (Not a Smart TV) works or not by using your friends or family and then purchase. The HDMI Port was properly works for Airtel DTH.The below request is for Amazon. Please specify the TV and their model with year for customer reference which can be used before purchasing.",1375,1,0
1,1,1,Rajesh Kumar,2020-10-16,Good thing comes in small packages :),"I have a 4k stick and I was in love with it. So, bought this for my projector where I don't need power /volume buttons as my projector can't be controlled using the remote.Ordered immediately as it was available. Got it on same day evening. Love you Amazon for quick delivery.Product. Initial impression.Plug in, connect, everything is done by them. Tried pairing with 4k remote and works. It's smooth UI as good or better compared to 4k. Didn't feel the lag which was felt with full hd stick (previous version).With in 10 minutes, started watching IPL. 5.1 support.If you are looking to buy for a TV, please go for the remote with power/volume buttons. If you're looking to connect to monitor, projector etc, go for the lite version.Dolby Atmos I couldn't try as I don't have that. Dolby digital Plus working without any issues.Over all a great buy. No comparison need with Mi stick as its no where near to this.Happy viewing",400,5,0
2,2,2,Avi,2020-10-18,Amazing but could be better,"This stick is amazing in every way possible except for the fact it's has limited streaming quality settings The only options it provides are hd and full hd unlike the good, better, best options in the browser or app. Also these settings do not affect the quality of stream on the other apps. You have to set the streaming quality in each app separately for example, youtube, hotstar, voot, etc.Quality of remote does not feel up-to the mark. The battery flap moves a little every-time you grab the remote.There are a few things missing currently which can make this stick even better:-1) volume normalization,2) Equalizer settings3) Ability to download at-least prime video content and view offline.4) Option to show and search only the content which we have access to. Its a waste of time when you search for a movie and it opens it in the app you don't have subscription to.Still amazing device overall at an amazing price.",382,5,0
3,3,3,Amar,2020-10-19,Product not working,"I want to return it, as is not supporting to my samsung LCD tv. It's just giving error ""Mode not supported. Pls check resolution""After several try i could not fix it.",73,1,0
4,4,4,Amazon Customer,2020-10-24,Wonderful🤩,"I wanted to order 3rd gen , but it went out of stock and delivery time was 25th Nov.So I ordered the 2099 version where the difference is only in remote. In this version remote does not have on off button for tv or volume buttons. But it is manageable because I have a tv remote.So this is my first purchase1. The packaging was very good2. Got one day delivery  ... Superb3. Setup was easy4. Took a few minutes to update software and login into my prime and other subscription accounts5. And wow its so much fun to watch all the shows on TV which I have been watching on mobile or laptop6. Very easy to pair your bluetooth headphones with the bluetooth of this device7. Watch your favourite shows without disturbing anyone8. Alexa works perfect. Just select English India for better experience.I dont see any cons or connectivity issues as of now. I have an internet cable connection with 10 mbps speed and the streaming works seamlessly without any issues and picture quality is great tooAll in all I love this device and great for those like me who donot have a smart tv or android tv as yet.",57,5,1
5,5,5,Gunjan Gupta,2020-10-17,Same hardware as Firetvstick 2020 and Firetvstick 4K in lesser price.,"I had an older version of firetvstick and also have firetvstick 4k. I was thinking to upgrade my older firetvstick to a newer version and hence have bought the lite version as its the same hardware as the firetvstick 2020 and firetvstick 4k i.e. all of them uses the same processor from mediatek. Both lite and 2020 editions have 1 GB of ram, while the 4K edition has 1.5 gb of ram. Both 2020and lite edition has 4K disabled, but as I dont have a 4K tv and most likely will not buy one for next 5 years, it doesnt really matter to me.The lite edition comes with the lite version of the remote i.e. the remote will not have the power and volume button for the tv.For me there is one downside though. The devices actually comes Fire OS 7 with Android Security Patch level as 05 October 2018 based on Android Pie, which is quite old. The older Fire OS 6 that comes in the 4K edition has a newer security patch level of late 2019 (forgot the exact value) even though that is based on Android 7",49,5,0
6,6,6,VS25,2020-10-19,Name is Lite but Performance is Pro,"This is my first firestick so don't know about previous sticks performances but if u ask me about this one ""Its just Amazing"".Picture quality, performance, Firestick quality everything is just superb.I dont find any cons yet.Also, in this version there will be no option of volume/Power or mute button so if you are okay then bliandly go for it.(personally i am okay with using 2 remotes this is not an issue for me)Apps : Netflix,Prime video, Hotstar, Zee5, Voot, Sony liv, Discovery, Mx Player, Jio Cinema, Apple Tv and many more.Note: you can sideload 3rd party apps by which you will definitely forget the dth.",44,5,0
7,7,7,Jatin Verma,2020-10-15,Excellent product,Excellent product,51,5,0
8,8,8,Amol Bapat,2020-10-21,"If you want to make your FHD TV smart, just go for it.","I converted our old Sony Bravia 32'' TV to a smart TV in few minutes using this. This firetv stick has a smooth UI, you will not feel any lag. Also with a good internet connection, the streaming and downloading of the apps was quick enough.The quality of the remote is good, better than what u get on MiTv stick. Also, on MiTv stick, the UI is bit laggy and you can notice it.You can watch Youtube as well and you can cast from your android device to the fireTvStick. Even without chromecast.Overall a good product, only downside is no power and volume button on the remote, but if you can look past this, it's a must buy. Got this at  Rs. 1999/- during the GIF sale",34,5,0
9,9,9,Ashish,2020-10-19,Fire tv lite,"Tried one app, It does not allow to view free content.Though there is Mobile app , it ask to open browser and enter the codeSome apps like airtel xstream is not available.Difficult to get resolution from customer careSpent too much time with customer care, probably it would help to have dedicated email to sort out questions",31,1,0
10,10,10,Kunal Lalvani,2020-10-15,Amazing Fire Stick Lite by Amazon,"Its superb... Fast, very easy to instal.. Few mins of download and update app all ready... Apps can be easily downloaded. Nice Product.. Had pre ordered it and got the delivery today on launch date 15.10.20.So far its fast and easy to use. :) Happy with New Fire Stick Lite Gen 3",81,5,1
11,11,11,WRITZ,2020-10-20,Nice and Simple,"Very nice and simple.Features:1. Turns any LED/LCD TV having HDMI Port into a smart TV. Supports 1080p max. For those who have non smart TVs with good condition and not willing to upgrade.2. Very simple remote, with simple functionality buttons (arrow keys, select, Home, return, options, fast forward and backward etc) *but no volume up/down.How to Connect:Plug in the stick in TV's HDMI port, provide power to the stick using provided cable and follow the on screen instructions. Very First time it will take several updates. It takes half an hour to complete the setup.Contains a Homepage, where all recent watches, all Apps, all movies, series are there.Other tabs are Settings, Movies etc.Internet charges and app subscriptions are applicable separately.",22,5,0
12,12,12,Geet,2020-10-18,Wow...luv it,I m in luv with this product...easy to install nd really thousands of apps give me satisfaction nd give me a way to remove dth....best product...and ofcourse youtube gave hundred of hodden features that didn't show in booklet...so finally satisfactied with this...go for it without hasitation...first i m confused with amazon's oyher fire tv stick but this is best aand pocket friendly...,16,5,0
13,13,13,divya,2020-10-27,Loving it...❤️❤️,My first fire tv stick....its an amazing experience indeed...happy to have bought it although i was skeptical abt buying dis since long...but d decision came out to be ryt.....since i dont have wifi or broadband ...using it wid mobile data hotspot.....2 gb daily is enough for daily usage...amazing ...tnks amazon.....hope i dont have to face any problems in future in its functionality....long live my dear firestick....😛👌🏻Update : after 6 mths usage...d remote has malfunctioned...dis is really sad....i m bound to return it now whei m addicted to it....dis is really sad....now when we have replaced our set up boxes wid fire stick.....d remote us dead too soon.....i ll have nto buy a new stick dat is costlier.....nd wat if its remote also malfunctiones after 6 mths...... amazon plz upgrade its quality.....so dat we don't have to buy it repeatedly due to remote malfunctioning..,15,5,0
14,14,14,naresh,2020-10-25,Pathetic Service,"Really Pathetic service. the fire stick was having an issue and wanted a replacement, called customer service told me to reset which didn't do anything, called a second time said will place a request for replacement but the request was not placed by customer care and had to wait called again another agent placed the request but delivery guys called and said will come tomorrow and other day called again and said will come tomorrow again.Really Poor service.",18,1,0
15,15,15,Debapriyo Biswas,2020-10-17,Hanged several times in a day,Fire stick lite’s performance is very poor. I have just received and during the day three times it has been hanged and after removing the batteries and refitted it has worked.,18,1,0
16,16,16,Hitesh,2020-10-20,Best Product Just read review......👍,"Best product for Casting as well making your old TV to smart TV. Easy and very Fat Setup.Only thing you need fast data connection for Use.Alexa Voice command very Fast and responsive.For mirror screening of your phone no need of data connection that good to watch movie from your phone to cast on TV.  As now a days old TV are not supporting some of the video format. 😀😀😀Go for it, for life version only difference Power off button and Volume button which are rarely used if you have TV remote.Like it.........👍👍",12,5,1
17,17,17,Sharanya Nair,2020-10-24,Mind-blowingly good!,"Well, I had always wanted fire stick and this time with the lite version released I bought it. It is pretty compact, and user friendly. And the videos are in 1080p resolution. It's pretty smooth. Only difference is that this version does not include TV controls like volume button, but then you already have a TV remote to control volume. It's been a week since I've been using it and I'm in love with it. You can download apps and stores and browse through internet too. It made my TV a smart TV now, haha. And I got it at 1999inr which is a very good deal. So I would say, go for it.",12,5,1
18,18,18,TOTO,2020-11-06,Google Chromecast & Volume Control Missing,"I purchased fire tv stick and also mi tv stick, device built quality and performance of firestick is good, firestick supports casting features with some apps but google chromecast features is best in casting which mi tv stick supports and mi stick remote comes with power and volume control buttons, mi stick getting heat and does not support any usb input, firestick produce less heating and also supports usb devices except mechanical hard disks, usb host otg cable needed for this, AirScreen app helps in casting one should try this,4 star for firestick 1 star less for no volume controls4 star for mi stick 1 star less for no usb support",10,4,0
19,19,19,Jeetu,2020-11-02,Lite version as stated.,"This Lite fire stick does not support Dolby Digital stream as stated in the description..only Stereo option available to choose in Audio option while playing any movie/video even though settings in Menu Audio were selected on Best Available..tried selecting Dolby Digital as well manually but while playing a video or movie, the Dolby digital stream is not available.I bought a 4K fire stick as well..that allows you to choose between Stereo and Dolby Digital stream in the movie itself which is recognised by my receiver and plays in full glory.This strictly is for those only looking to make their TV smart, but if you need Dolby digital signal output then the 4K version is the one to buy and there is huge difference even in the TV volume and clarity when Dolby is selected and also video clarity as well as I use a projector and the difference between the 2 is noticeable.",8,3,0
20,20,20,BODHISATTWA DAS,2020-10-17,A awesome product from Amazon,"This is my first TV stick . And honestly speaking , this is awesome . Picture quality is 8/10 . Only this lite version doesn't have audio controller , so you have to rely on yout tv remote , but that's not a big deal .  Also you can pay few extra bucks to get a higher version of Amazon TV stick and that has a inbuilt audio controller.It's works great with Alexa and all other Alexa controller. I checked yt kids , yt and discovery plus and all are working as smooth as I use them in my mobile or desktop .Thanks Amazon for this great release.",10,5,0
21,21,21,P.S,2020-11-04,Superb product by amazon !!,"Very easy to set up. It did take a little while as it was downloading updates. I was a little disappointed as I had planned to buy this during sale, but when I called amazon customer care they told me it wouldn’t work on a tv before 2014. I had bought my tv much before that and I did say I have an HDMI port but the lady said it yet wouldn’t work.It has worked on my tv !!Works very well.",8,4,0
22,22,22,Manish patel,2020-11-05,Average,"Pros:1.comes with hdmi extensor cable.Cons:1.mi stick is android based and come with Chromecast built in, while in fire stick it comes with mira cast and it keeps lagging.2.mi stick comes with volume controls at same price3.if your remote will get off after warranty period,than new Amazon tv stick remote costs around 2000 for new one where new mi stick remote costs 500 for New one .Update:so many apps are unavailable, which are available on android tv or android based tv sticks.Edit: Amazon customer care response is good they helped me with defected remote and exchange with refurbished new remote.",8,4,0
23,23,23,Shivaji,2020-11-25,Alexa stopped working after update to new UI,"Update: It started updating and it updated to new UI provided by Amazon. But after update Alexa stopped working! All the other buttons are working except the voice button. I tried using Fire TV app also but through that also Alexa not working! No response in TV, no blue line. Just Alexa not working.Also other than this Alexa problem the new UI is slower than old interface and has a lot of other bugs like overlapping of controls, slow refresh etc.Old review: For first month ago was good but recently it keep stuck during downloading update! It does not hang, I can go out of the menu but it doesn't complete either even after waiting for 20 minutes! It is not problem of internet as all the streaming is going nicely. I don't know how to contact for stick support!",7,2,0
24,24,24,Raj Giri,2020-11-11,Good but not the best like Android TV stick,"Everything is awesome sound and picture quality both improved from normal tv but I need to highlight few cons of this product:1. It has separate LIVE TV CHANNELS SECTION, when you click on it, it extracts all the live channels from all the available apps like Voot etc (but u should have premium subscription of that app). I have Prime, Voot, Zee5 premium subscription but ZEE5 live tv channels aren't available on live tv section. Then OBVIOUSLY THERE'S NO USE OF LIVE TV CHANNELS OPTION IF IT CAN'T EXTRACT ALL THE CHANNELS FROM PREMIUM APPS.2.If you directly go to homepage from on going app and open other app then opened new app starts lagging. May be this is due to 1gb of RAM.3. In android tv u have a option of voice control on your keyboard. Means you don't have to type anything in the app. You just have to click on voice and say n it will write for you whatever you say in the app. But this FEATURE IS MISSING IN FIRE TV STICK. I searched for other keyboard but this option is not available.4. If you want to use THOP TV or OREO TV then guys it will not show you the logo of these apps. Here logo will be blank which looks very bad. And the channels you open on these two apps have not that good quality which can be seen on proper smart android tv. Thop tv and oreo tv channels quality is awesome on my other Smart tv that means these two apps are having issues in Fire tv stick only.5. Voice response must be in hindi and english both. I wanted everything in English written but alexa response on both hindi and english.(the language u ask, alexa must answer in that language)...I hope all these features mentioned above by me above will be resolved in next updates then it will 5 star rated product and I will change my rating from 3 to 5.",7,3,0
25,25,25,JaganAasha,2020-11-07,Waste of time and money,"It's a fault device, everyday we start the firetv it's showing blank screen again we need to power off and on then only its working. Everyday we are facing same issue. It's just a bakwas device. Never buy. Waste of time and money.",10,1,0
26,26,26,Gaurav Kumar,2020-10-28,Everything is perfect but two things are very bad...,"First of all the biggest drawback is that you cannot cast videos from your mobile app like hotstar,zee5,mx player etc to any fire stick,you can only cast videos from youtube and i talked to fire stick company and they told me that after new uprade you will also not be able to cast videos from youtube also.Another drawback is its remote because it doesn't have volume key which is very important but there is a solution also for this problem is that you can buy standard version of fire stick...Except these the user interface is excellent...and every thing is perfect....Screen Mirroring is also very nice....If you don't use screen casting and you can use tv remote every time for volume control then you can go for it without any doubt.If you want screen casting and use single remote then you should go for standard version for single remote and if you want both then go for mi stick....",7,3,0
27,27,27,Ayan,2020-10-30,Great Deal,"Your browser does not support HTML5 video.
  The device is definitely an improvement over the previous edition which used to be slow and buggy.Features are adequate and performance is smooth. Never faced any issues like connectivity or heating. Alexa voice recognition has also improved. Pairing is easy with any bluetooth devices. 3d games run smooth too.Screen sharing works well for every devices except for Samsung's smart view, also for windows pc, device must be at a close range and faster wifi!Hope next versions will have improved ram size.Got it for around 1900 (including cashbacks).Great deal!",6,5,0
28,28,28,Neeraj Kumar Saroya,2020-10-17,Easy to use...Just go for it.,"Quick to install and smooth to use. Better than any cast device available in market. The only issue is volume buttons which seems to be important. Just for this we have to keep two remotes in hand all the time. Alexa voice recognition is very responsive (with Hindi words as well)Final wordsGo for it if you are looking for budget friendly, good quality casting product.Note :  Made in China",6,5,0
29,29,29,MJ,2020-10-22,Blindly Go for it when your budget is 2k.,"It is the best in the market at this price segment. We know that it doesn't have volume control with remote, but Amazon should understand the need of voice controlled remote & provide us the same, i.e, for example - Alexa, decrease/increase or lower the volume then by default 10% vol. Decreases... With that feature added with software update, I'm sure it's gonna change the way we watch tv.Amazon is purely taking advantage of the consumer setiments by triggering the need of volume control by button/voice assistant. Hence asking them to pay more. At this price specially those who are buying this product are saving 500 bucks only for volume controls as there is no difference between the main version and the lite one other than volume controls.Hoping, with the update they bring voice control of volume atleast.Personally i loved the FIRE OS, lag free and definitely smoother than Android OS.Ram management looks good, cache memory occupies much storage so please go and manually clear apps' cache after use.On this latest version i see they have removed many apps from appstore which is not good. Anyways you can sideload many apps by watching youtube videos.Some of them finding difficult it to install, but it's really easy if you have cleared your board exams you should atleast know this.At around 2k range, just go for this one. I hope it works well for 2 years atleast with decent usage.",6,5,0
30,30,30,Sai Krishna Maddukuri,2020-10-19,Excellent streaming device,"The fire TV stick lite is very good and it is very fast , the voice serach is good ... The installation is very easy .. it updates very fast and easy to login .. I didn't even experience d buffering while playing the video even with the mobile hotspot .I am very happy that it made LED tv to smart instantly.Buy if you need to make your led tv to smart .I recommend this fire TV lite rather than fire TV stick .. if you need tv controls better go for normal version .",5,5,1
31,31,31,Yash,2020-10-16,Another amazing product by Amazon,Excellent product. No buffering issues faced. Just lacks volume button and power key but doesn't really matter. Very responsive UI and superb picture clarity. All major apps works fine. Highly recommend product.,8,5,0
32,32,32,Mohd Anis Ansari,2020-10-18,Not working,Purchased from Amazon sale for Rs.1999/- but unfortunately not working so returned it....,8,1,0
33,33,33,Roshan,2020-10-20,Fire tv stick review,Product received faulty from the amazonAt the first day itself it was not connectingVery bad service.disappointing customer,9,1,0
34,34,34,Jigs,2020-11-04,Works only with extender and Alexa voice remote needs improvement,"It's faster but user interface could have been better. You can't control the speed or move back and forth episodes or resume from the last seen episode in many apps. Also Alexa voice remote is not able to recognise the voice sometimes and it really gets irritating to find what you need and you feel like why you went for the stick, but other times it works fine.Also it didn't work without extender and it started working only after I plugged in the extender",4,3,0
35,35,35,Bit-tech,2020-12-20,Great stick at less bucks,It is definitely one of the best tv sticks you can have.Better than mi or other sticks because it has a faster soc and the software is really really nice.Also go to settings> MY FIRE TV and update before using.You will love it for sure.Mark it as helpful to encourage me to write more reviews😉 as i am kinda lazy.,4,5,1
36,36,36,Joel john,2021-04-22,LED to Smart LED @ 2k,"It took 2 hours for successful startup on first time....I almost felt like it was not working with my TV (Samsung 32 inch LED 2014 model EH4003).....after switching on & off for more than twenty times....atlast it displayed firetv......So, keep the firestick on for atleast one hour for first time....then restart the firestick..... From day 2 till now (2 months)there were no issues....it usually startup within 10-15 seconds....Streaming was great ....No issues with apps....audio .... bluetooth ... connectivity...... Everything works great....We can install any apps and games....Browser is also usefulRemote is wireless and you can use it any directionTry atleast 2 days or several times before returning if product not working first time.If you are planning to buy settop box like airtel xtream, tata binge , etc ...please never think about it....They consume subscription charges for providing those xstream and binge services....Firestick is better choice with one time investment.",2,5,0
37,37,37,Amazon Customer,2020-11-01,Some cons,"Bought the lite version, product is good but some cons i am noticed. I am using Sony smart tv, the picture clarity compared to sony is not good when using fire stick lite, over saturated pictures. Wifi reception is also not good compared to my sony smart tv. I am getting 15 to 20 mbps speed where the tv is fixed , and when sony smart tv playing in 1080p with out buffering but when we  use fire stick lite 1080p is buffering, except this every thing is fine.Possibility of remote battery will need to  change within a month or two because of blutooth remote.",4,4,0
